{
  "version": "1.0.0",
  "releaseDate": "2024-11-20",
  "packages": [
    {
      "registryType": "npm",
      "identifier": "@modelcontextprotocol/server-github",
      "version": "1.0.0",
      "transport": {
        "type": "stdio"
      }
    }
  ],
  "_meta": {
    "io.modelcontextprotocol.registry/publisher-provided": {
      "example": true
    }
  }
}
